{
  "id": "brave-001",
  "name": "Brave",
  "codename": "EX-BRAVE-001",
  "version": "0.1.0",
  "scale_class": "25m",
  "category": "player",
  "description": "초기형 브레이브. 단순 실루엣, 성장 전 기본 기체.",
  "base_body": {
    "template": "standard_25m",
    "slots": {
      "head": { "part_id": "head_basic_01", "enabled": true },
      "torso_upper": { "part_id": "torso_upper_basic_01", "enabled": true },
      "torso_lower": { "part_id": "torso_lower_basic_01", "enabled": true },
      "arm_l": { "part_id": "arm_basic_01", "enabled": true, "mirror_source": "arm_r" },
      "arm_r": { "part_id": "arm_basic_01", "enabled": true },
      "leg_l": { "part_id": "leg_basic_01", "enabled": true, "mirror_source": "leg_r" },
      "leg_r": { "part_id": "leg_basic_01", "enabled": true },
      "backpack": { "part_id": null, "enabled": false },
      "skirt": { "part_id": null, "enabled": false },
      "weapon_l": { "part_id": null, "enabled": false },
      "weapon_r": { "part_id": null, "enabled": false },
      "thruster": { "part_id": null, "enabled": false }
    }
  },
  "parameters": {
    "height": 25.0,
    "mass": 48.5,
    "armor_thickness": 1.0,
    "mobility": 0.7,
    "output": 0.65
  },
  "visual": {
    "primary_color": "#C0C8D0",
    "secondary_color": "#2A3A4A",
    "accent_color": "#E8A020",
    "style_tags": ["modern_super", "organic_mechanical", "simple", "retro"]
  },
  "tags": ["brave", "initial", "player", "25m"],
  "status": "concept",
  "created": "2026-08-02",
  "updated": "2026-08-02",
  "notes": "첫 번째 실제 데이터 등록. ParaModel 구조 검증용."
}
